{
  "$schema": "https://json-schema.org/draft/2020-12/schema",
  "title": "HVLIEN Ready Report v1",
  "type": "object",
  "additionalProperties": false,
  "required": [
    "schema_version",
    "run_id",
    "timestamp",
    "status",
    "checks",
    "recommended_commands",
    "notes"
  ],
  "properties": {
    "schema_version": {
      "type": "integer",
      "const": 1
    },
    "run_id": {
      "type": "string"
    },
    "timestamp": {
      "type": "string"
    },
    "status": {
      "type": "string",
      "enum": [
        "ready",
        "not_ready",
        "warn"
      ]
    },
    "checks": {
      "type": "array",
      "items": {
        "type": "object",
        "additionalProperties": false,
        "required": [
          "id",
          "status",
          "details"
        ],
        "properties": {
          "id": {
            "type": "string"
          },
          "status": {
            "type": "string",
            "enum": [
              "pass",
              "fail",
              "warn",
              "skip"
            ]
          },
          "details": {
            "type": "object",
            "additionalProperties": true
          }
        }
      }
    },
    "recommended_commands": {
      "type": "array",
      "items": {
        "type": "string"
      }
    },
    "notes": {
      "type": "array",
      "items": {
        "type": "string"
      }
    }
  }
}